,"﻿""Key""",Item Type,Publication Year,Author,Title,Publication Title,ISBN,ISSN,DOI,Url,Abstract Note,Date,Date Added,Date Modified,Access Date,Pages,Num Pages,Issue,Volume,Number Of Volumes,Journal Abbreviation,Short Title,Series,Series Number,Series Text,Series Title,Publisher,Place,Language,Rights,Type,Archive,Archive Location,Library Catalog,Call Number,Extra,Notes,File Attachments,Link Attachments,Manual Tags,Automatic Tags,Editor,Series Editor,Translator,Contributor,Attorney Agent,Book Author,Cast Member,Commenter,Composer,Cosponsor,Counsel,Interviewer,Producer,Recipient,Reviewed Author,Scriptwriter,Words By,Guest,Number,Edition,Running Time,Scale,Medium,Artwork Size,Filing Date,Application Number,Assignee,Issuing Authority,Country,Meeting Name,Conference Name,Court,References,Reporter,Legal Status,Priority Numbers,Programming Language,Version,System,Code,Code Number,Section,Session,Committee,History,Legislative Body,asreview_label,asreview_time,asreview_note
21,HHX3Y7VV,conferencePaper,2024,"Nachabe, L.; Hannou, F.-Z.; Lefrançois, M.; Jubault, M.",Toward Agile Interaction Model based ontology development Methodology (AIME) for FAIR European data spaces,CEUR Workshop Proc.,16130073 (ISSN); 9789666544899 (ISBN); 9788073780029 (ISBN); 9788024810256 (ISBN); 9789986342748 (ISBN); 9788073781712 (ISBN); 9782954494807 (ISBN); 9788024823911 (ISBN); 9789562361989 (ISBN); 8024810255 (ISBN); 807378002X (ISBN),,,https://www.scopus.com/inward/record.uri?eid=2-s2.0-85214559076&partnerID=40&md5=a093f6066db7ddc6166cc967c9b2da8c,"The European Union’s initiative on European data spaces aims to support innovation and economic growth by facilitating secure, interoperable data sharing across key sectors such as health, energy, and mobility. Within European data spaces, high priority is given to adherence to FAIR data principles. Thus, data and services should be findable, accessible, interoperable, and reusable. Ontologies as semantic models are fundamental in achieving semantic interoperability, as they provide a common framework for data and service access, discovery, understanding and reuse. However, the inherent complexity of data space initiatives, coupled with their underlying domains diversity are key challenge facing optimal FAIRness. This motivates the need for an agile methodology that aligns with data space principles, integrates existing domain standards, consolidates the use of metadata for ontology’s FAIRness, and engages various involved actors (domain experts, data service providers, ontology engineers) towards the development of common data space ontology. In the frame of the OMEGA-X project, aiming to build an energy data space, this paper presents AIME, an ontology development methodology integrating the reuse of both standards and reference ontologies to enable the development of modular ontologies for data spaces. It leverages agile principles to strengthen communication between various stakeholders through different steps: reference standards and ontologies selection, selection of use cases, design and selection of interaction models capturing data exchanges, ontology modules creation, automation and continuous integration features to support the entire original ontology engineering phase and reuse by data space users. © 2024 Copyright for this paper by its authors.",2024,2026-01-17 07:02:47,2026-01-17 07:09:03,,,,,3882,,,,,,,,CEUR-WS,,English,,,Scopus,,,,Journal Abbreviation: CEUR Workshop Proc.,,,,Ontology; Ontology's; Data space; Data consistency; Agile developement; Development methodology; European standards; European Standards; FAIR principle; FAIR principles; Interaction modeling; Modular ontologies; Ontology development; Ontology Engineering Methodologies; Ontology engineering methodology; LR_Query: Scopus_02; LR_SearchDate: 2026-01-17,,"Oliveira, I.; Barcelos, P.P.F.; Calhau, R.; Fonseca, C.M.; Righetti, G.; De Giorgis, S.; Sacco, G.; Hedblom, M.M.; Kutz, O.; Glauer, M.; Stappel, M.; Trojahn, C.; Poveda-Villalon, M.; Garijo, D.; Bernabe, C.H.; Lin, A.Y.; Compagno, F.; Fensel, A.; Terkaj, W.; Adamo, G.; Dooley, D.; Kumpel, M.; Bordea, G.; Warren, R.; Sehar, A.; Lange, M.; Bindt, F.; Toxopeus, I.; Audrito, D.; Grasso, F.; Nai, R.; Sulis, E.; Beverley, J.; Jensen, M.; de Cesare, S.; Gailly, F.; Guizzardi, G.; Partridge, C.; Partridge, C.; Pastor, O.; Castro, A.G.; Hubauer, T.; Suess, W.; Schmurr, P.; Willis, M.; Santamaria, D.F.; van Ede, T.; Klein, D.; Engelberg, G.; Engelberg, G.; Castiglione, G.; Bella, G.; Continella, A.; Lanti, D.; Mosca, A.; Scafoglieri, F.M.; Xiao, G.; Kutt, K.; Fernandez-Breis, J.T.; Pichler, A.; Palko, G.; Nalepa, G.J.; Garbacz, P.; Pergl, R.; Khan, Z.C.; Barcelos, P.P.F.; Moreira, J.; Barton, A.; Sanfilippo, E.M.; Daniele, L.; Almeida, J.P.A.; Franconi, E.; Johannesson, P.; Ghidini, C.; Zamborlini, V.",,,,,,,,,,,,,,,,,,,,,,,,,,,,,,CEUR Workshop Proceedings,,,,,,,,,,,,,,,,1,2026-01-17 10:08:34,
81,MWMWH2TW,conferencePaper,2020,"Masoumi, H.; Farahani, B.; Shams, F.S.",An Ontology-based Open Data Interoperability Approach for Cross-Domain Government Data Services,"Int. Comput. Conf., Comput. Soc. Iran, CSICC",9781728159379 (ISBN),,10.1109/CSICC49403.2020.9050079,https://www.scopus.com/inward/record.uri?eid=2-s2.0-85083362931&doi=10.1109%2FCSICC49403.2020.9050079&partnerID=40&md5=c687e9ebffb8b009646620fb8aa5a81e,"Open Government Data (OGD) has emerged as a radical paradigm shift and endeavor among government administrations across the world largely due to its promises of transparency, accountability, collaboration, civic participation, social innovation as well as data-driven value creation. Data service is a critical component for OGD which guarantees the availability of government data to users in the form of structured and machine-readable open datasets. Aspects such as usability, quality, and interoperability should be considered in building such open datasets. The diversity of data sets usually hampers unlocking the full potential value of data. Interoperability addresses the ability of open data platforms and data services to communicate, exchange and consume data, and to operate effectively together. To tackle this issue, in this paper, we propose an ontology-based technique enabling governmental organizations to identify their public data and publish them via well-defined interoperable data services. In this context, an Open Governmental Data Platform including a portal (www.iranopendata.ir) and a data management system (www.ogdms.iranopendata.ir) is designed and developed to fulfill this goal. As a case study, the constructed platform has been utilized and evaluated in the Tehran Municipality organization. The results show that applying the proposed approach leads to the creation of high-quality datasets achieving a high degree of interoperability. © 2020 IEEE.",2020,2026-01-17 07:02:47,2026-01-17 07:09:03,,,,,,,,,,,,,Institute of Electrical and Electronics Engineers Inc.,,English,,,Scopus,,,,"Journal Abbreviation: Int. Comput. Conf., Comput. Soc. Iran, CSICC",,,,Interoperability; Ontology; Information management; Open Data; Data interoperability; Ontology-based; Data management system; Government data publishing; Open data; Electronic government; Critical component; Electronic data service; Government administration; Paradigm shifts; Potential values; Social computing; Social innovations; LR_Query: Scopus_02; LR_SearchDate: 2026-01-17,,,,,,,,,,,,,,,,,,,,,,,,,,,,,,,,,,,,,,,,,,,,,,,,1,2026-01-17 10:11:07,
112,LALLWG43,conferencePaper,2018,"Nesi, P.; Po, L.; Viqueira, J.R.R.; Trillo Lado, R.",An Integrated Smart City Platform,Lect. Notes Comput. Sci.,03029743 (ISSN); 9789819698936 (ISBN); 9789819698042 (ISBN); 9789819698110 (ISBN); 9789819698905 (ISBN); 9783032004949 (ISBN); 9789819512324 (ISBN); 9783032026019 (ISBN); 9783032008909 (ISBN); 9783031915802 (ISBN); 9789819698141 (ISBN),,10.1007/978-3-319-74497-1_17,https://www.scopus.com/inward/record.uri?eid=2-s2.0-85045307577&doi=10.1007%2F978-3-319-74497-1_17&partnerID=40&md5=a864769fe4b6ced7525eed0ccd4f0d1a,"Smart Cities aim to create a higher quality of life for their citizens, improve business services and promote tourism experience. Fostering smart city innovation at local and regional level requires a set of mature technologies to discover, integrate and harmonize multiple data sources and the exposure of effective applications for end-users (citizens, administrators, tourists..). In this context, Semantic Web technologies and Linked Open Data principles provide a means for sharing knowledge about cities as physical, economical, social, and technical systems, enabling the development of smart city services. Despite the tremendous effort these communities have done so far, there exists a lack of comprehensive and effective platforms that handle the entire process of identification, ingestion, consumption and publication of data for Smart Cities. In this paper, a complete open-source platform to boost the integration, semantic enrichment, publication and exploitation of public data to foster smart cities in local and national administrations is proposed. Starting from mature software solutions, we propose a platform to facilitate the harmonization of datasets (open and private, static and dynamic on real time) of the same domain generated by different authorities. The platform provides a unified dataset oriented to smart cities that can be exploited to offer services to the citizens in a uniform way, to easily release open data, and to monitor services status of the city in real time by means of a suite of web applications. © Springer International Publishing AG 2018.",2018,2026-01-17 07:02:48,2026-01-17 07:09:03,,171-176,,,10546 LNCS,,,,,,,,Springer Verlag service@springer.de,,English,,,Scopus,,,,Journal Abbreviation: Lect. Notes Comput. Sci.,,,,Semantic Web; Ontology; Public administration; Data integration; Semantic Web technology; Linked data; Smart city; Open data; Open datum; Arches; Multiple data sources; Open source platforms; Open source software; Semantic enrichment; Sharing knowledge; Smart Cities; Smart city platform; Software solution; Technical systems; LR_Query: Scopus_02; LR_SearchDate: 2026-01-17,,"Szymanski, J.; Velegrakis, Y.",,,,,,,,,,,,,,,,,,,,,,,,,,,,,,Lecture Notes in Computer Science,,,,,,,,,,,,,,,,1,2026-01-17 10:11:52,
47,B6YGDNBN,journalArticle,2022,"Masoumi, H.; Farahani, B.; Shams Aliee, F.",Systematic and ontology-based approach to interoperable cross-domain open government data services,"Transforming Government: People, Process and Policy",,17506166 (ISSN),10.1108/TG-08-2021-0132,https://www.scopus.com/inward/record.uri?eid=2-s2.0-85121499379&doi=10.1108%2FTG-08-2021-0132&partnerID=40&md5=ab9a016729f3797697b5b384b5b4279b,"Purpose: Open government data (OGD) has emerged as a radical paradigm shift and endeavor among government administrations across the world mainly due to its promises of transparency, accountability, public-private collaboration, civic participation, social innovation and data-driven value creation. Complexity, cross-cutting nature, diversity of data sets, interoperability and quality issues usually hamper unlocking the full potential value of data. To tackle these challenges, this paper aims to provide a novel solution using a top-down approach. Design/methodology/approach: In this paper, the authors propose a systematic ontology-based approach combined with a novel architecture and its corresponding processes enabling organizations to carry out all the steps in the OGD value chain. In addition, an OGD Platform including a portal (www.iranopendata.ir) and a data management system (www.ogdms.iranopendata.ir) are developed to showcase the proposed solution. Findings: The efficiency and the applicability of the solution are evaluated by a real-life use case on energy consumption of the buildings of the city of Tehran, Iran. Finally, a comparison was made with existing solutions, and the results show the proposed approach is able to address the existing gaps in the literature. Originality/value: The results imply that modeling and designing the data model, as well as exploiting an ontology-based approach are critical pillars to create rich, relevant and well-described OGD data sets. Moreover, clarity on processes, roles and responsibilities are the key factors influencing the quality of the published data services. Thus, to the best of the knowledge, this is the first study that exploits and considers an ontology-based approach in a top-down manner to create OGD data sets. © 2021, Emerald Publishing Limited.",2022,2026-01-17 07:02:47,2026-01-17 07:09:03,,110-127,,1,16,,Trans. Gov. People Process Policy,,,,,,Emerald Group Holdings Ltd.,,English,,,Scopus,,,,,,,,Ontology; Data quality; Data interoperability; Semantic data; Open government data; Government data publishing; Open data; LR_Query: Scopus_02; LR_SearchDate: 2026-01-17,,,,,,,,,,,,,,,,,,,,,,,,,,,,,,,,,,,,,,,,,,,,,,,,1,2026-01-17 10:12:07,
62,LB49IQRG,conferencePaper,2021,"Yoshida, E.; Yokotani, T.; Ishibashi, K.; Mukai, H.",Proposals on the Root Data Domain Gateway and System Operations for IoT Data Interoperability,Int. Conf. Inf. Networking,19767684 (ISSN); 9781467302517 (ISBN); 9781509017249 (ISBN); 9798350330946 (ISBN); 0769509517 (ISBN); 9781728141985 (ISBN); 9781509051243 (ISBN); 9781665462686 (ISBN); 9781479936892 (ISBN); 9781538683507 (ISBN); 9781728191003 (ISBN),,10.1109/icoin50884.2021.9333863,https://www.scopus.com/inward/record.uri?eid=2-s2.0-85100793783&doi=10.1109%2Ficoin50884.2021.9333863&partnerID=40&md5=cc6eebd7bf5bd0c240669dc343ef10e1,"With the increasing developments in the Internet of Things (IoT), smart-city applications have been attracting widespread interest in many governments, organizations, and companies. The FED4IoT project is a research and innovation project that aims to develop a smart-city application, named 'VirIoT,' which realizes the semantic interoperability of IoT data among numerous IoT applications from different grounds. To realize the semantic interoperability of IoT data, data management on cloud platforms, such as FIWARE, is considered necessary. Therefore, the development of a root data domain gateway (RDG), which analyzes IoT data, converts its data format, and posts the data to the cloud service, is required. In this project, Kanazawa Institute of Technology has chosen wildlife monitoring as one of the use cases of the project, and its system using IoT has been designed and developed. Furthermore, its data model has been created for the development of the RDG. Finally, the RDG has been developed as a first step in the semantic interoperability of IoT data. © 2021 IEEE.",2021,2026-01-17 07:02:47,2026-01-17 07:09:03,,408-412,,,2021-January,,,,,,,,IEEE Computer Society,,English,,,Scopus,,,,Journal Abbreviation: Int. Conf. Inf. Networking,,,,Interoperability; Semantics; Data domains; Information management; Semantic interoperability; IoT; Data interoperability; Internet of things; Smart city; Data federation; Gateway; Gateways (computer networks); Government companies; Government organizations; Innovation programs; ITS data; Systems operation; LR_Query: Scopus_02; LR_SearchDate: 2026-01-17,,,,,,,,,,,,,,,,,,,,,,,,,,,,,,,,International Conference on Information Networking,,,,,,,,,,,,,,,,1,2026-01-17 10:13:19,
286,DDPQ2UGY,conferencePaper,2005,"Chen, C.-C.; Yeh, J.-H.; Sie, S.-H.",Government ontology and thesaurus construction: A taiwanese experience,Lect. Notes Comput. Sci.,03029743 (ISSN); 9789819698936 (ISBN); 9789819698042 (ISBN); 9789819698110 (ISBN); 9789819698905 (ISBN); 9783032004949 (ISBN); 9789819512324 (ISBN); 9783032026019 (ISBN); 9783032008909 (ISBN); 9783031915802 (ISBN); 9789819698141 (ISBN),,10.1007/11599517_30,https://www.scopus.com/inward/record.uri?eid=2-s2.0-33744923204&doi=10.1007%2F11599517_30&partnerID=40&md5=7382e032026885d156ea5a4cd94b6926,"Due to the quantity and the diversity involved in e-government presentations and operations, traditional approaches to web site information management have been found to be rather inefficient in time and cost. Consequently, the necessity of establishing a government knowledge management system, so as to speed up information lookups, sharing, and linkups, naturally arises. Moreover, this knowledge management system would in turn enhance e-government effectiveness as it helps to store and transmit information, be it explicit or implicit in nature. The first step in creating this knowledge management system is to build up the government ontology and thesaurus. Upon the completion of the ontology and thesaurus needed, semantic searching can be conducted, which in turn kickstarts other mechanisms required for effective information management. Our research team has been commissioned by the Executive Yuan of Taiwan to establish the draft of government ontology and thesaurus and to design a framework for multiple-layered information management systems upon which the ontology and thesaurus can be constructed. The goal of this paper is to present the government ontology and thesaurus which our research team has come up with as well as the related infrastructure and function of the multiple-layered information management system © Springer-Verlag Berlin Heidelberg 2005.",2005,2026-01-17 07:02:49,2026-01-17 07:09:03,,263-272,,,3815 LNCS,,,,,,,,Springer Verlag,,English,,,Scopus,,,,Journal Abbreviation: Lect. Notes Comput. Sci.,,,,Information management; Thesauri; Semantic interoperability; Knowledge management; Websites; Computer systems; Data storage equipment; Government ontology; Government thesaurus; Ontology editor; Table lookup; LR_Query: Scopus_02; LR_SearchDate: 2026-01-17,,,,,,,,,,,,,,,,,,,,,,,,,,,,,,,,Lecture Notes in Computer Science,,,,,,,,,,,,,,,,1,2026-01-17 10:17:56,
161,AR7W8RJY,journalArticle,2014,"Egloff, W.; Patterson, D.J.; Agosti, D.; Hagedorn, G.",Open exchange of scientific knowledge and European copyright: The case of biodiversity information,ZooKeys,,13132989 (ISSN),10.3897/zookeys.414.7717,https://www.scopus.com/inward/record.uri?eid=2-s2.0-84901986870&doi=10.3897%2Fzookeys.414.7717&partnerID=40&md5=5b2e512072e7b446a2c1facb682cdc9e,"Background. The 7th Framework Programme for Research and Technological Development is helping the European Union to prepare for an integrative system for intelligent management of biodiversity knowledge. The infrastructure that is envisaged and that will be further developed within the Programme ""Horizon 2020"" aims to provide open and free access to taxonomic information to anyone with a requirement for biodiversity data, without the need for individual consent of other persons or institutions. Open and free access to information will foster the re-use and improve the quality of data, will accelerate research, and will promote new types of research. Progress towards the goal of free and open access to content is hampered by numerous technical, economic, sociological, legal, and other factors. The present article addresses barriers to the open exchange of biodiversity knowledge that arise from European laws, in particular European legislation on copyright and database protection rights. We present a legal point of view as to what will be needed to bring distributed information together and facilitate its re-use by data mining, integration into semantic knowledge systems, and similar techniques. We address exceptions and limitations of copyright or database protection within Europe, and we point to the importance of data use agreements. We illustrate how exceptions and limitations have been transformed into national legislations within some European states to create inconsistencies that impede access to biodiversity information. Conclusions. The legal situation within the EU is unsatisfactory because there are inconsistencies among states that hamper the deployment of an open biodiversity knowledge management system. Scientists within the EU who work with copyright protected works or with protected databases have to be aware of regulations that vary from country to country. This is a major stumbling block to international collaboration and is an impediment to the open exchange of biodiversity knowledge. Such differences should be removed by unifying exceptions and limitations for research purposes in a binding, Europe-wide regulation. © Willi Egloff et al.",2014,2026-01-17 07:02:48,2026-01-17 07:09:03,,109-135,,414,,,ZooKeys,,,,,,Pensoft Publishers info@pensoft.net Geo Milev Street 13a Sofia 1111,,English,,,Scopus,,,,,,,,Biodiversity knowledge; Data use agreement; European copyright; European database protection right; Intellectual property rights; Open Access to data and information; Taxonomy; LR_Query: Scopus_02; LR_SearchDate: 2026-01-17,,,,,,,,,,,,,,,,,,,,,,,,,,,,,,,,,,,,,,,,,,,,,,,,1,2026-01-17 10:21:20,
208,P96HFPU5,bookSection,2011,"Taweel, A.; Delaney, B.; Speedie, S.",Towards Achieving Semantic Interoperability in eHealth Services,E-Healthcare Systems and Wirel. Communications: Current and Future Challenges,9781613501238 (ISBN); 9781613501245 (ISBN),,10.4018/978-1-61350-123-8.ch018,https://www.scopus.com/inward/record.uri?eid=2-s2.0-105013712901&doi=10.4018%2F978-1-61350-123-8.ch018&partnerID=40&md5=e857b2d90318dd46c5d0f40ff0240aa2,"One common and primary vision of eHealth is to achieve seamless interoperability between eHealth systems to enable the delivery of the right information about the right patient to the right person at the right time. However, the high sensitivity of the clinical domain and the vast differences in eHealth systems pose a great interoperability challenge for solutions that rely solely on prior knowledge of common interoperability standards will not sufficiently scale. This chapter presents a service-based approach that utilises domain ontologies combined with extensible problem models, enriched with domain terminology and knowledge services to enable autonomous data governance and semantic interoperability. The chapter addresses the resulting requirements and proposes a solution outlining the results from the prototype of the approach. © 2012 by IGI Global. All rights reserved.",2011,2026-01-17 07:02:48,2026-01-17 07:09:03,,388-401,,,,,,,,,,,IGI Global,,English,,,Scopus,,,,Journal Abbreviation: E-Healthcare Systems and Wirel. Communications: Current and Future Challenges,,,,Interoperability; Ontology; Semantics; Government data processing; Semantic interoperability; eHealth; Domain Knowledge; Domain ontologies; Service-based; Ehealth; E-health services; e-Health systems; High sensitivity; Knowledge service; Prior-knowledge; Problem models; LR_Query: Scopus_02; LR_SearchDate: 2026-01-17,,,,,,,,,,,,,,,,,,,,,,,,,,,,,,,,,,,,,,,,,,,,,,,,1,2026-01-17 10:21:55,
153,RGX4K4DP,journalArticle,2015,"Çağdaş, V.; Stubkjaer, E.",Core immovable property vocabulary for european linked land administration,Survey Review,,00396265 (ISSN),10.1179/1752270614Y.0000000093,https://www.scopus.com/inward/record.uri?eid=2-s2.0-84920146403&doi=10.1179%2F1752270614Y.0000000093&partnerID=40&md5=52bcc5f502d5f8de4888d276f3bbdbc2,"Public information regarding immovable property is recorded in national registries, including cadastre and land registry, building and dwelling (or address) registry, and property tax registry. An efficient land administration system is supposed to orchestrate these registries for crossborder and cross-sector land administration services. The recent developments in Semantic Web technologies and the Linked Data approach provide an efficient and flexible solution for web based integration of datasets recorded in these registries. The mentioned registries were specified according to different data models and standards which lead to interoperability problems. The concerned public organisations therefore need a common data model that clearly identifies the recording units of these registries and their core attributes, as well as relationships between them. The present research responds to this requirement by developing a common vocabulary, a Core Immovable Property Vocabulary, as an extension to the e-Government Core Vocabularies (version 1.0) issued recently by the European Commission (EC). The Core Immovable Property Vocabulary is developed by simplifying and capturing the minimal characteristics of complex domain standards and data specifications, thereby enabling a plain representation of immovable property units and their core attributes that are needed for land administration processes. It thus allows for the publication of land administration data sets within the Resource Description Framework (RDF), and renders the integration of land administration datasets with other registries such as address and civil registries encoded according to the e- Government Core Vocabularies. The vocabulary is the result of an individual research effort, carried out by the authors of the present article, and has recently been hosted by the EC ISA (Interoperability Solutions for European Public Administration) Joinup platform as a semantic asset (see https://joinup.ec.europa.eu/asset/cipv/description). The main contribution is the introduction of the Linked Data approach to the land administration domain which may make land administration data sets more accessible via the Web. © 2015 Survey Review Ltd.",2015,2026-01-17 07:02:48,2026-01-17 07:09:03,,49-60,,340,47,,Surv. Rev.,,,,,,Maney Publishing maney@maney.co.uk,,English,,,Scopus,,,,,,,,Linked Data; cadastre; land management; European Commission; World Wide Web; Cadastre; e-Government Core Vocabularies; Land administration; land registration; Linked land administration; LR_Query: Scopus_02; LR_SearchDate: 2026-01-17,,,,,,,,,,,,,,,,,,,,,,,,,,,,,,,,,,,,,,,,,,,,,,,,1,2026-01-17 10:22:37,
