,"﻿""Key""",Item Type,Publication Year,Author,Title,Publication Title,ISBN,ISSN,DOI,Url,Abstract Note,Date,Date Added,Date Modified,Access Date,Pages,Num Pages,Issue,Volume,Number Of Volumes,Journal Abbreviation,Short Title,Series,Series Number,Series Text,Series Title,Publisher,Place,Language,Rights,Type,Archive,Archive Location,Library Catalog,Call Number,Extra,Notes,File Attachments,Link Attachments,Manual Tags,Automatic Tags,Editor,Series Editor,Translator,Contributor,Attorney Agent,Book Author,Cast Member,Commenter,Composer,Cosponsor,Counsel,Interviewer,Producer,Recipient,Reviewed Author,Scriptwriter,Words By,Guest,Number,Edition,Running Time,Scale,Medium,Artwork Size,Filing Date,Application Number,Assignee,Issuing Authority,Country,Meeting Name,Conference Name,Court,References,Reporter,Legal Status,Priority Numbers,Programming Language,Version,System,Code,Code Number,Section,Session,Committee,History,Legislative Body,asreview_label,asreview_time,asreview_note
254,Z2MV7JF5,journalArticle,2008,"Muthaiyah, S.; Kerschberg, L.",Achieving interoperability in e-government services with two modes of semantic bridging: SRS and SWRL,Journal of Theoretical and Applied Electronic Commerce Research,,,10.4067/S0718-18762008000200005,https://www.scopus.com/inward/record.uri?eid=2-s2.0-60149110519&doi=10.4067%2FS0718-18762008000200005&partnerID=40&md5=72f1ff72082a59bd321d254819369ca3,"Data heterogeneity in the public sector is a serious problem and remains to be a key issue as different naming conventions are used to represent similar data labels. The e-government effort in many countries has provided a platform for government entities and their business partners to exchange data through Information Communication Technologies (ICT) and standards such as RosettaNet (B2B data exchange standard), EDIFACT (Electronic Data Interchange for Administration, Commerce, and Transport), XML (Extensible Markup Language) and EDI (Electronic Data Interchange). However, e-government efforts have not really resolved data heterogeneity problems significantly due to limitation of these standards. One such limitation is the inability of data inheritance. In order to solve this problem with emphasis on Service Oriented Architectures (SOA) and Web Services, a semantically enriched web service for the public sector is needed. Thus we propose an ontology-based solution which allows data inheritance and polymorphism. This goal of this paper is to show how heterogeneous e-government documents can be semantically matched. We propose a shared hierarchical knowledge repository approach and a detailed process methodology for semantic mediation. A two-part semantic mediation approach using SRS (Semantic Relatedness Scores) and SWRL (Semantic Web Rule Language) is highlighted. Both measures are complimentary and provide the semantics necessary for resolving schema heterogeneity. Our approach incorporates a rule-based engine that reads and executes SWRL rules (i.e. RacerPro). We also adopted several tools for proof-of-concept such as Protege (i.e. ontology editor) and JESS (Java Expert Shell System). © 2008 Universidad de Talca-Chile.",2008,2026-01-17 07:02:49,2026-01-17 07:09:03,,52-63,,3,3,,J. Theor. Appl. Electron. Commer. Res.,,,,,,Universidad de Talca,,English,,,Scopus,,,,,,,,Ontology; Web services; XML; Semantic web; Semantic; EDI; Mediation reasoning; Syntactic; LR_Query: Scopus_02; LR_SearchDate: 2026-01-17,,,,,,,,,,,,,,,,,,,,,,,,,,,,,,,,,,,,,,,,,,,,,,,,1,2026-01-17 11:44:18,EC1 – Off-topic
43,6LIQ2ZNR,journalArticle,2023,"Younsi Dahbi, K.Y.; Chiadmi, D.; Lamharhar, H.",Knowledge Graph based Representation to Extract Value from Open Governement Data An Application to the Public Procurement Domain,International Journal of Advanced Computer Science and Applications,,2158107X (ISSN),10.14569/IJACSA.2023.0140329,https://www.scopus.com/inward/record.uri?eid=2-s2.0-85151805160&doi=10.14569%2FIJACSA.2023.0140329&partnerID=40&md5=8984dce446afa1e91c91ea72207b11e7,"Open government data refers to data that is made available by government entities to be freely reused by anyone and for any purpose. The potential benefits of open government data are numerous and include increasing transparency and accountability, enhancing citizens' quality of life, and boosting innovation. However, realizing these benefits is not always straightforward, as the usage of this raw data often faces challenges related to its format, structure, and heterogeneity which hinder its processability and integration. In response to these challenges, we propose an approach to maximize the usage of open government data and achieve its potential benefits. This approach leverages knowledge graphs to extract value from open government data and drive the construction of a knowledge graph from structured, semi-structured, and non-structured formats. It involves the extraction, transformation, semantic enrichment, and integration of heterogeneous open government data sources into an integrated and semantically enhanced knowledge graph. Learning mechanisms and ontologies are used to efficiently construct the knowledge graph. We evaluate the effectiveness of the approach using real-world public procurement data and show that it can detect potential fraud such as favoritism © 2023, International Journal of Advanced Computer Science and Applications.All Rights Reserved.",2023,2026-01-17 07:02:47,2026-01-17 07:09:03,,255-262,,3,14,,Intl. J. Adv. Comput. Sci. Appl.,,,,,,Science and Information Organization,,English,,,Scopus,,,,,,,,Semantics; Metadata; Data mining; Data integration; Graphic methods; Knowledge graphs; Open Data; Knowledge graph; Open government data; Digital storage; Crime; fraud detection; Fraud detection; Government entities; Graph construction; Graph-based representations; knowledge graph construction; Knowledge graph construction; open government data; Potential benefits; public procurement; Public procurement; LR_Query: Scopus_02; LR_SearchDate: 2026-01-17,,,,,,,,,,,,,,,,,,,,,,,,,,,,,,,,,,,,,,,,,,,,,,,,1,2026-01-17 11:46:03,
230,PSVE3C8W,journalArticle,2009,"Waters, J.; Powers, B.J.; Ceruti, M.G.","Global Interoperability Using Semantics, Standards, Science and Technology (GIS3T)",Computer Standards and Interfaces,,09205489 (ISSN),10.1016/j.csi.2009.03.001,https://www.scopus.com/inward/record.uri?eid=2-s2.0-68949205031&doi=10.1016%2Fj.csi.2009.03.001&partnerID=40&md5=e6bc8188174defac237583da60ee22f6,"""Global Interoperability Using Semantics, Standards, Science and Technology"" is a concept that is predicated on the assumption that the semantic integration, frameworks and standards that support information exchange, and advances in science and technology can enable information-systems interoperability for many diverse users. This paper recommends technologies and approaches for enabling interoperability across a wide spectrum of political, geographical, and organizational levels, e.g. coalition, federal, state, tribal, regional, non government, and private. These recommendations represent steps toward the goal of the Semantic Web, where computers understand information on web sites through knowledge representations, agents, and ontologies.",2009,2026-01-17 07:02:49,2026-01-17 07:09:03,,1158-1166,,6,31,,Comput Stand Interfaces,,,,,,,,English,,,Scopus,,,,,,,,Interoperability; Semantic Web; Ontology; Semantics; Standards; Metadata; Knowledge representation; Information exchanges; Semantic integration; Systems interoperability; Technology; Common operational picture; Computer resource management; Distributed computer resources; North Atlantic Treaty Organization (NATO); Organizational levels; Science and Technology; Wide spectrum; LR_Query: Scopus_02; LR_SearchDate: 2026-01-17,,,,,,,,,,,,,,,,,,,,,,,,,,,,,,,,,,,,,,,,,,,,,,,,1,2026-01-17 11:46:28,
33,2HSBN5IP,conferencePaper,2023,"Loutsaris, M.; Alexopoulos, C.; Maratsi, M.I.; Charalabidis, Y.",Semantic Interoperability for Legal Information: Mapping the European Legislation Identifier (ELI) and Akoma Ntoso (AKN) Ontologies,ACM Int. Conf. Proc. Ser.,9798400709135 (ISBN); 9798400707667 (ISBN); 9798400708312 (ISBN); 9798400716287 (ISBN); 9798400708466 (ISBN); 9798400707681 (ISBN); 9798400709142 (ISBN); 9798400708244 (ISBN); 9798400708855 (ISBN); 9798400708015 (ISBN),,10.1145/3614321.3614327,https://www.scopus.com/inward/record.uri?eid=2-s2.0-85180125711&doi=10.1145%2F3614321.3614327&partnerID=40&md5=9e0c9819c3d64979283c1e813f36b842,"The legislative landscape, characterized by overwhelming amounts of legal data which, on many occasions, is only accessible by legal experts, the fragmented nature of information and the ever-increasing number of disparate systems, have given more impetus to the interoperability realm of legal data. The semantic interoperability of Linked Open Legal Data (LOLD) requires rich and well-defined metadata, as well as the establishment of standards, in order to be able to connect and link these scattered legal data resources. This is usually achieved through the transformation of legal information into structured format and through the utilization of legal ontologies whose main purpose is to connect the legal basis of two or more countries by allowing for reusability and the ability to adequately represent legal information, which is understood and retrieved across borders. Within the context of this study, the European Legislation Identifier (ELI) and Akoma Ntoso (AKN) ontologies are mapped in order to make legal data compatible and reusable in as many contexts as possible and to support the Linked Open Legal Data (LOLD) concept. The mapping of these two widely used legal ontologies was evaluated by domain experts and strongly validated by tools. The usefulness of the produced mapping is proven through its real-life context application, although one thing to consider regarding possible future perspectives, could be the inclusion and mapping of more legal ontologies to expand the application domain and improve the semantic interoperability of legal information. These mappings could be either achieved using similar methodological approaches or applications of automated and AI-based ontology mapping techniques. © 2023 Owner/Author.",2023,2026-01-17 07:02:47,2026-01-17 07:09:03,,41-53,,,,,,,,,,,Association for Computing Machinery,,English,,,Scopus,,,,Journal Abbreviation: ACM Int. Conf. Proc. Ser.,,,,Interoperability; Ontology; Semantics; semantic interoperability; Ontology's; Mapping; Legal ontology; Semantic interoperability; Computer software reusability; Open Data; European legislation; Laws and legislation; legal data; Legal data; legal information; Legal information; Linked data; Linked open legal data; linked open legal data (LOLD); OGD; ontology mapping; Ontology mapping; Open government data; Open Government Data; Reusability; LR_Query: Scopus_02; LR_SearchDate: 2026-01-17,,"Getschko, D.; Lindgren, I.; Yildiz, M.",,,,,,,,,,,,,,,,,,,,,,,,,,,,,,,,,,,,,,,,,,,,,,1,2026-01-17 11:55:09,
145,ZUZADY4Y,conferencePaper,2015,"Liu, C.-H.; Bau, J.-F.; Lee, C.-R.",Integrating various data sources of geospatial information systems with semantics,"Proc. - Int. Conf. Inf. Sci. Control Eng., ICISCE",9781467368506 (ISBN),,10.1109/ICISCE.2015.67,https://www.scopus.com/inward/record.uri?eid=2-s2.0-84938766246&doi=10.1109%2FICISCE.2015.67&partnerID=40&md5=fa4d9cb5bd7e57e7a39956159f0f40a2,"To effectively integrate distributed and heterogonous open data now is an essential problem of Web research community. Due to rapidly development of open data, e.g. geographic, track, dynamic geospatial data, governments are required to release more and more data for academics and industry. The ubiquitous data are in various types and formats, e.g. number, graphic or specific format provided by different data sources, in distributed environment. All makes it difficult to integrate data to different domain. This paper proposes a data-flow integration mechanism with a unified description for distributed and heterogonous open data. Our approach starts with using Semantic Web technology and web ontology language (OWL), to define a data flow-oriented semantic description model. This supports a domain view description which is a user's aspect of domain. In this model, users are able to describe a domain view via three main components: 1) data unit, 2) link unit, and 3) domain unit. Final, we use earthquake disaster event as our example depict how the data flow-oriented semantic description model work conceptually. And our solution ensures data interoperability and provides a unified semantic description model to integrate heterogeneous data. © 2015 IEEE.",2015,2026-01-17 07:02:48,2026-01-17 07:09:03,,274-278,,,,,,,,,,,Institute of Electrical and Electronics Engineers Inc.,,English,,,Scopus,,,,"Journal Abbreviation: Proc. - Int. Conf. Inf. Sci. Control Eng., ICISCE",,,,Semantic Web; Ontology; Data integration; Semantic Web technology; Open Data; Data interoperability; Semantic web; Web ontology language; Data flow analysis; Data transfer; Distributed environments; Geo-spatial information systems; Geography data; Integration mechanisms; Semantic descriptions; LR_Query: Scopus_02; LR_SearchDate: 2026-01-17,,"Li, S.; Dai, Y.; Cheng, Y.",,,,,,,,,,,,,,,,,,,,,,,,,,,,,,,,,,,,,,,,,,,,,,1,2026-01-17 11:56:46,
240,KM9Z635Q,conferencePaper,2008,"Francesconi, E.; Faro, S.; Marinai, E.",A framework for semantic mapping between thesauri,ACM Int. Conf. Proc. Ser.,21531633 (ISSN); 9781450377881 (ISBN); 9781450385855 (ISBN); 9781450314398 (ISBN); 9781450396387 (ISBN); 9781450390019 (ISBN); 9781450390217 (ISBN); 9781450348270 (ISBN); 9781450381963 (ISBN); 9781450322485 (ISBN); 9781450348201 (ISBN),,10.1145/1509096.1509147,https://www.scopus.com/inward/record.uri?eid=2-s2.0-70349142645&doi=10.1145%2F1509096.1509147&partnerID=40&md5=5561d67c399bcf03df67af193524082c,Thesaurus interoperability is an important property which guarantees quality in indexing and retrieval of heterogeneous data sources in a distributed environment. It contributes to guarantee semantic interoperability of public services and information quality which are essential features of eGov-ernment implementation policies. This paper presents a methodological framework for semantic mapping between thesauri as well as a specific approach within such framework on a case study aimed at mapping five thesauri of interest for European Union institutions having only schema information available. Copyright 2008 ACM.,2008,2026-01-17 07:02:49,2026-01-17 07:09:03,,251-257,,,351,,,,,,,,,,English,,,Scopus,,,,Journal Abbreviation: ACM Int. Conf. Proc. Ser.,,,,Interoperability; Semantics; Public services; Thesauri; Mapping; Semantic interoperability; European Union; Semantic mapping; Heterogeneous data sources; Distributed environments; Thesaurus mapping; Indexing and retrieval; Information quality; Methodological frameworks; Schema information; Term semantics; LR_Query: Scopus_02; LR_SearchDate: 2026-01-17,,,,,,,,,,,,,,,,,,,,,,,,,,,,,,,,ACM International Conference Proceeding Series,,,,,,,,,,,,,,,,1,2026-01-17 11:59:06,
131,77UGFURP,journalArticle,2016,"Leadbetter, A.M.; Shepherd, A.; Arko, R.; Chandler, C.; Chen, Y.; Dockery, N.; Ferreira, R.; Fu, L.; Thomas, R.; West, P.; Zednik, S.",Experiences of a “semantics smackdown”,Earth Science Informatics,,18650473 (ISSN),10.1007/s12145-016-0252-8,https://www.scopus.com/inward/record.uri?eid=2-s2.0-84958771987&doi=10.1007%2Fs12145-016-0252-8&partnerID=40&md5=1a70079836695b06ac11541a18b3aefe,"Within the field of ocean science there is a long history of using controlled vocabularies and other Semantic Web techniques to provide a common and easily exchanged description of datasets. As an activity within the European Union, United States, Australian-funded project “Ocean Data Interoperability Platform”, a workshop took place in June 2014 at Rensselaer Polytechnic Institute to further the use of these Semantic Web techniques with the aim of producing a set Linked Data publication patterns which describe many parts of a marine science dataset. During the workshop, a Semantic Web development methodology was followed which promoted the use of a team with mixed skills (computer, data and marine science experts) to rapidly prototype a model ontology which could be iterated in the future. In this paper we outline the methodology employed in the workshop, and examine both the technical and sociological outcomes of a workshop of this kind. © 2016, Springer-Verlag Berlin Heidelberg.",2016,2026-01-17 07:02:48,2026-01-17 07:09:03,,355-363,,3,9,,Earth Sci. Informatics,,,,,,Springer Verlag service@springer.de,,English,,,Scopus,,,,,,,,Semantic Web; Linked Data; United States; European Union; data set; World Wide Web; Australia; Development Patterns; development project; marine technology; oceanography; Oceanography; Workshop Methodology; LR_Query: Scopus_02; LR_SearchDate: 2026-01-17,,,,,,,,,,,,,,,,,,,,,,,,,,,,,,,,,,,,,,,,,,,,,,,,1,2026-01-17 12:01:32,
167,RFV37DWD,journalArticle,2013,"Greenberg, J.; Delgado-Azuara, F.; Hilera, J.; Ruggia, R.",Proposal of a controlled vocabulary to solve semantic interoperability problems in social security information exchanges,Library Hi Tech,,07378831 (ISSN),10.1108/LHT-02-2013-0018,https://www.scopus.com/inward/record.uri?eid=2-s2.0-84886780396&doi=10.1108%2FLHT-02-2013-0018&partnerID=40&md5=e6ab98b1ada6a3536b44f43dab6194b6,"This report aims to present the state of play of semantic interoperability problems in social security data exchanges. The subject is presented as an open issue and taking into account the circumstances of the exchanges. Electronic exchanges in European Union social security are used as a case study. Semantic level of these exchanges seems to be the weakness and the use of controlled vocabularies is proposed as possible solution. The creation and maintenance of metadata sets are finally considered as a compromise solution. The article proposes a solution for the current semantic problems in electronic exchanges of social security information. The solution could be useful for social security institutions all over the world. © 2013, Emerald Group Publishing Limited",2013,2026-01-17 07:02:48,2026-01-17 07:09:03,,602-619,,4,31,,Libr. Hi Tech,,,,,,,,English,,,Scopus,,,,,,,,Interoperability; Metadata; eGovernment; Vocabulary; Social security; LR_Query: Scopus_02; LR_SearchDate: 2026-01-17,,,,,,,,,,,,,,,,,,,,,,,,,,,,,,,,,,,,,,,,,,,,,,,,1,2026-01-21 08:16:06,
194,GP6CHJBY,conferencePaper,2011,"Orlowski, R.; Jahns, V.",Bridging the IT/Process Divide in public administrations by simple semantic interoperability artefacts,"Proc. European Conf. on e-Gov., ECEG",20491034 (ISSN); 9781908272010 (ISBN); 9781910810989 (ISBN); 1905305184 (ISBN); 9781906638085 (ISBN); 9781905305186 (ISBN); 9781909507326 (ISBN); 9781905305001 (ISBN); 9781911218388 (ISBN); 9781910810194 (ISBN); 9781906638634 (ISBN),,,https://www.scopus.com/inward/record.uri?eid=2-s2.0-84870917045&partnerID=40&md5=084edc30a00082a227e810d08de521e5,"Semantic interoperability is an objective that has been addressed in many research projects and publications in the past by the development or presentation of new artefacts (approaches, ontologies, tools, etc.). Mostly, different aspects of semantic interoperability have been addressed, which distinguished these artefacts from each other. But on the other hand, all these artefacts have one characteristic in common: they are big, complex,complicated, not easy to understand for people who are not familiar with the concepts and technology of the Semantic Web, and (sometimes) not easy to integrate into legacy systems. But this is crucial in the context of public administration, because there are small- and medium-sized public authorities, e.g., municipalities with limited resources, as well as big and advanced public authorities with a sufficient amount of resources, but existing information systems that cannot be replaced easily, e.g., because they are customized to local needs. In this work in progress paper the question is posed, how the technology regarding the facilitation of semantic interoperability can be simplified, so that these concepts and technology are first of all more understandable to employees and second easier to implement in small- and medium-sized public authorities like municipalities. A deliberation on this question promises the possibility, that the barriers for using these concepts and technology in municipality can be reduced and, that the municipalities can take advantage of these concepts and technology. Some ideas how this question can be approached are outlined in this poster paper.",2011,2026-01-17 07:02:48,2026-01-17 07:09:03,,657-657,,,,,,,,,,,,,English,,,Scopus,,,,"Journal Abbreviation: Proc. European Conf. on e-Gov., ECEG",,,,Interoperability; Semantic Web; Public administration; Public services; Government data processing; Semantic interoperability; Semantic web; e-Government; eGovernment; Public authorities; Legacy systems; Management; Public service; Technology; Work in progress; LR_Query: Scopus_02; LR_SearchDate: 2026-01-17,,,,,,,,,,,,,,,,,,,,,,,,,,,,,,,,"Proceedings of the European Conference on e-Government, ECEG",,,,,,,,,,,,,,,,1,2026-01-21 08:19:31,
83,JWKJ9J8S,conferencePaper,2020,"Viegas, C.; Vasconcelos, A.; Borbinha, J.; Chora, Z.",A Canonical Data Model for Records Management in the Portuguese Public Administration,Lect. Notes Bus. Inf. Process.,18651348 (ISSN); 9783032045119 (ISBN); 9783642357015 (ISBN); 9783030057664 (ISBN); 9783031602597 (ISBN); 9783662471562 (ISBN); 9783319741604 (ISBN); 9783031616563 (ISBN); 9783031161674 (ISBN); 3642018556 (ISBN); 9783642280818 (ISBN),,10.1007/978-3-030-40783-4_11,https://www.scopus.com/inward/record.uri?eid=2-s2.0-85081603620&doi=10.1007%2F978-3-030-40783-4_11&partnerID=40&md5=4cc9afbc51a0fc133064b96192137ec2,"The Portuguese public administration is a highly regulated environment, where business processes are subject to strong requirements for records management. Therefore business metadata must be produced and maintained along with the regular business objects, to enable effective information exchange. In that sense, when entities of this domain engage in exchanges of information, it is helpful for those involved if also the metadata produced can be exchanged, which requires it to be commonly understood. This research proposes a Canonical Data Model that supports semantic interoperability in the Portuguese public administration, by defining a set of metadata elements for describing records. The proposed solution is compared against other related data models, and its qualities are assessed using the Bruce-Hillman metadata quality framework. Furthermore, the analysis of the proposed solution reveals the proposed model promotes semantic interoperability within the Portuguese public administration, by ensuring the information exchanged retains its original business context meaning. © Springer Nature Switzerland AG 2020.",2020,2026-01-17 07:02:47,2026-01-17 07:09:03,,210-249,,,378 LNBIP,,,,,,,,Springer,,English,,,Scopus,,,,Journal Abbreviation: Lect. Notes Bus. Inf. Process.,,,,Interoperability; Semantics; Public administration; Metadata; Information management; Information systems; Information use; Information exchanges; Semantic interoperability; Metadata quality; Business Process; Business contexts; Business objects; Canonical data model; Canonical Data Model; Records management; Records management metadata; LR_Query: Scopus_02; LR_SearchDate: 2026-01-17,,"Filipe, J.; Smialek, M.; Brodsky, A.; Hammoudi, S.",,,,,,,,,,,,,,,,,,,,,,,,,,,,,,Lecture Notes in Business Information Processing,,,,,,,,,,,,,,,,1,2026-01-21 08:21:58,
64,9HTHCVMP,journalArticle,2021,"Pérez, F.J.; García S, A.; Garrido, V.J.; Esteve, M.; Zambrano-Vizuete, M.",C2 Advanced Multi-domain Environment and Live Observation Technologies,"International Journal of Computers, Communications and Control",,18419836 (ISSN),10.15837/IJCCC.2021.6.4251,https://www.scopus.com/inward/record.uri?eid=2-s2.0-85125381695&doi=10.15837%2FIJCCC.2021.6.4251&partnerID=40&md5=ec38a8c1571b359767399f6316e6993b,"Nowadays, the free movement of people and goods within the European Union is one of the topical issues. Each member state and border practitioner exploits its own set of assets in their goal of border surveillance and control. States have invested significantly in these assets and infrastructures necessary to manage and control the transit in the border areas. As new capabilities and assets become available and as current Command and Control (C2) systems become older, border control practitioners are faced with the increasing challenge of how to integrate new assets, command and control all of them in a coordinated and coherent way without having to invest in a completely new C2 systems built from the ground up. Therefore, and bearing in mind that the systems already developed up to date are very old and are not framed in a global standard data model, it has been identified, on one side the need to define a platform that allows to interact with multiple UxVs (land, sea and air), and on the other, unify all data models so that it can globalize and generate a much more concise analysis of what happens in places of conflict. © 2021. by the authors.",2021,2026-01-17 07:02:47,2026-01-17 07:09:03,,,,6,16,,Int. J. Comput. Commun. Control,,,,,,Agora University,,English,,,Scopus,,,,,,,,Border Control; Distributed Infrastructure; Situational Awareness; UxVs; LR_Query: Scopus_02; LR_SearchDate: 2026-01-17,,,,,,,,,,,,,,,,,,,,,,,,,,,,,,,,,,,,,,,,,,,,,,,,1,2026-01-21 08:23:26,
